### ISSUE TITLE
For Azure China Error obtaining authorization token: Error refreshing token: invalid character '<' looking for beginning of value

### ISSUE THREAD

**Issue by nicocesar** [hashicorp/terraform#11131]
### Terraform Version
terraform version: 0.8.3  b845cb7093c24c49ece854bb38b55aff3783f195

### Affected Resource(s)
azure_resource_group

(but I think this affects the refreshing of the authentication token

### Terraform Configuration Files
https://www.dropbox.com/s/ij7u77i37mvwbb1/invalid_character_error.zip?dl=0

### Debug Output
https://www.dropbox.com/s/su4rqy8bm90xon4/invalid_character_error.txt.asc?dl=0
encrypted for: 
```
pub  2048R/32EA77F3 2014-02-26 HashiCorp Security <security@hashicorp.com>
 Primary key fingerprint: 91A6 E7F8 5D05 C656 30BE  F189 5185 2D87 348F FC4C
      Subkey fingerprint: E5E7 92FA E106 A1B3 B272  B65D D5F4 3B64 32EA 77F3

```

### Expected Behavior
Detect that the resource is already created ,  or create new ones 

also #6769 should provide better HTTP debug. 

### Actual Behavior
```
Error applying plan:

1 error(s) occurred:

* azurerm_resource_group.rg: Error creating resource group: Error obtaining authorization token: Error refreshing token: invalid character '<' looking for beginning of value

```

### Steps to Reproduce
terraform apply -state mystate.tfstate -var-file invalid_character_error.tfvars -target=azurerm_virtual_machine.switchyard > invalid_character_error.txt 2>&1

### Important Factoids
This is in azure China.  There could be a possibility that the queried endpoints are wrong leading to a html/xml reply at some point of the authorization token refresh. If we had the full string instead of only the offending character maybe we can debug it better  .

**Comment by nicocesar** [comment]
I ran  tcpdump in the background and I see that is connecting to **login.chinacloudapi.cn**

```
2017/01/10 15:40:58 [DEBUG] root: eval: *terraform.EvalApply
azurerm_resource_group.rg: Creating...
  location:  "" => "chinaeast"
  name:      "" => "d8kp5"
  tags.%:    "" => "1"
  tags.Name: "" => "d8kp5"
2017/01/10 15:40:58 [DEBUG] apply: azurerm_resource_group.rg: executing Apply
15:40:58.067575 IP buildbox.curoverse.com.33701 > login.chinacloudapi.cn.https: Flags [S], seq 501367314, win 17922, options [mss 8961,sackOK,TS val 888694315 ecr 0,nop,wscale 6], length 0
15:40:58.379307 IP login.chinacloudapi.cn.https > buildbox.curoverse.com.33701: Flags [S.], seq 994014373, ack 501367315, win 8192, options [mss 1440,nop,wscale 8,sackOK,TS val 43393125 ecr 888694315], length 0
15:40:58.379323 IP buildbox.curoverse.com.33701 > login.chinacloudapi.cn.https: Flags [.], ack 1, win 281, options [nop,nop,TS val 888694393 ecr 43393125], length 0
15:40:58.379430 IP buildbox.curoverse.com.33701 > login.chinacloudapi.cn.https: Flags [P.], seq 1:164, ack 1, win 281, options [nop,nop,TS val 888694393 ecr 43393125], length 163
(..)
15:41:03.721009 IP buildbox.curoverse.com.33702 > login.chinacloudapi.cn.https: Flags [.], ack 20628, win 543, options [nop,nop,TS val 888695729 ecr 43451218], length 0
15:41:03.721740 IP buildbox.curoverse.com.33702 > login.chinacloudapi.cn.https: Flags [P.], seq 655:708, ack 20628, win 543, options [nop,nop,TS val 888695729 ecr 43451218], length 53
15:41:03.721770 IP buildbox.curoverse.com.33702 > login.chinacloudapi.cn.https: Flags [F.], seq 708, ack 20628, win 543, options [nop,nop,TS val 888695729 ecr 43451218], length 0
2017/01/10 15:41:03 [DEBUG] root: eval: *terraform.EvalWriteState
2017/01/10 15:41:03 [DEBUG] root: eval: *terraform.EvalApplyProvisioners
2017/01/10 15:41:03 [DEBUG] root: eval: *terraform.EvalIf
2017/01/10 15:41:03 [DEBUG] root: eval: *terraform.EvalWriteState
2017/01/10 15:41:03 [DEBUG] root: eval: *terraform.EvalWriteDiff
2017/01/10 15:41:03 [DEBUG] root: eval: *terraform.EvalApplyPost
2017/01/10 15:41:03 [ERROR] root: eval: *terraform.EvalApplyPost, err: 1 error(s) occurred:

* azurerm_resource_group.rg: Error creating resource group: Error obtaining authorization token: Error refreshing token: invalid character '<' looking for beginning of value
2017/01/10 15:41:03 [ERROR] root: eval: *terraform.EvalSequence, err: 1 error(s) occurred:

* azurerm_resource_group.rg: Error creating resource group: Error obtaining authorization token: Error refreshing token: invalid character '<' looking for beginning of value

```

**Comment by nicocesar** [comment]
@grubernaut actually is provider/azurerm tag

**Comment by nicocesar** [comment]
solved my problem:

```
diff --git a/vendor/github.com/Azure/go-autorest/autorest/azure/environments.go b/vendor/github.com/Azure/go-autorest/autorest/azure/environments.go                        
index ebf754e..3371830 100644                                                                                                                                               
--- a/vendor/github.com/Azure/go-autorest/autorest/azure/environments.go
+++ b/vendor/github.com/Azure/go-autorest/autorest/azure/environments.go
@@ -79,7 +79,7 @@ var (
                PublishSettingsURL:        "https://manage.chinacloudapi.com/publishsettings/index",
                ServiceManagementEndpoint: "https://management.core.chinacloudapi.cn/",
                ResourceManagerEndpoint:   "https://management.chinacloudapi.cn/",
-               ActiveDirectoryEndpoint:   "https://login.chinacloudapi.cn/?api-version=1.0",
+               ActiveDirectoryEndpoint:   "https://login.chinacloudapi.cn/",
                GalleryEndpoint:           "https://gallery.chinacloudapi.cn/",
                KeyVaultEndpoint:          "https://vault.azure.cn/",
                GraphEndpoint:             "https://graph.chinacloudapi.cn/",

```

got inspired by doing this:

```
azure account env show AzureChinaCloud
info:    Executing command account env show
data:    Name:                                              AzureChinaCloud
data:    activeDirectoryEndpointUrl:                        https://login.chinacloudapi.cn

```

does this make sense to apply a patch?

**Comment by nicocesar** [comment]
how is    azurerm_storage_account.storage.primary_blob_endpoint  being used? I'm getting **blob.core.windows.net** But actually is **blob.core.chinacloudapi.cn**:


```
azure account env show AzureChinaCloud
(..)
data:    storageEndpointSuffix:                             .core.chinacloudapi.cn
```

**Comment by wuyicang** [comment]
Have this been merged? I get the same error on Azure China with version 0.8.8 and 0.9.1

**Comment by nicocesar** [comment]
same on version 0.9.3
