### ISSUE TITLE
AzureRM fails for  USGov

### ISSUE THREAD

**Issue by pburkholder** [hashicorp/terraform#10895]
The AzureRM provider fails to even run `terraform plan` when using a USGov account. Will likely fail for China and Germany too.

### Terraform Version

`Terraform v0.8.1`

### Affected Resource(s)

AzureRM

### Terraform Configuration Files

```
provider "azurerm" {
  subscription_id = "11111111-222222-33333"
  tenant_id = "11111111-222222-33334
  client_id = "11111111-222222-33335"
  client_secret = "3333333-44444-5555"
}

# Create a resource group
resource "azurerm_resource_group" "terraform_demo" {
    name     = "terraform_demo"
    location = "USGovVirginia"
#    location = "eastus"
}

```

### Debug Output

https://gist.github.com/pburkholder/bd1e716caa858119fe2e68a7f4ecda18

### Expected Behavior

`terraform plan` works

### Actual Behavior

```
Error refreshing state: 1 error(s) occurred:

2016/12/21 12:11:21 [DEBUG] plugin: waiting for all plugin processes to complete...
* Credentials for accessing the Azure Resource Manager API are likely to be incorrect, or
  the service principal does not have permission to use the Azure Service Management
  API.
```

### Steps to Reproduce

1. Have a USGov subscription, and login with it
2. Create a service principal with:

```
az ad sp create-for-rbac --name "http://terraform.demo" \
  --role "Contributor" --scopes "/subscriptions/$SUBSCRIPTION_ID" --verbose
```
3. Update the .tf file with appropriate tokens and credentials
4. Run `terraform plan`
5. Watch the error

### Important Factoids

1. Watching `tcpdump` I see traffic to the standard API, not the usgov one, management.usgovcloudapi.net.

```
12:10:34.468537 IP xcoh2j-3befvh8.home.51342 > wireless_broadband_router.home.domain: 58205+ AAAA? management.azure.com. (38)
12:10:34.468564 IP xcoh2j-3befvh8.home.58776 > wireless_broadband_router.home.domain: 27344+ A? management.azure.com. (38)
12:10:34.505287 IP 104.211.48.17.https > xcoh2j-3befvh8.home.53061: Flags [.], ack 904, win 511, options [nop,nop,TS val 110468775 ecr 573642779], length 0
12:10:34.523095 IP wireless_broadband_router.home.domain > xcoh2j-3befvh8.home.58776: 27344 4/0/0 CNAME arm-rpfd-prod.trafficmanager.net., CNAME eastus.management.azure.com., CNAME rpfd-prod-bl-01.cloudapp.net., A 40.76.78.16 (160)
12:10:34.580511 IP wireless_broadband_router.home.domain > xcoh2j-3befvh8.home.51342: 58205 3/1/0 CNAME arm-rpfd-prod.trafficmanager.net., CNAME eastus.management.azure.com., CNAME rpfd-prod-bl-01.cloudapp.net. (236)
12:10:34.580966 IP xcoh2j-3befvh8.home.53062 > 40.76.78.16.https: Flags [S], seq 2995917756, win 65535, options [mss 1460,nop,wscale 5,nop,nop,TS val 573642890 ecr 0,sackOK,eol], length 0
12:10:34.596046 IP 40.76.78.16.https > xcoh2j-3befvh8.home.53062: Flags [S.], seq 835199399, ack 2995917757, win 8192, options [mss 1440,nop,wscale 8,sackOK,TS val 16671362 ecr 573642890], length 0
12:10:34.596102 IP xcoh2j-3befvh8.home.53062 > 40.76.78.16.https: Flags [.], ack 1, win 4105, options [nop,nop,TS val 573642905 ecr 16671362], length 0
```

2. There isn't any support in the code for `ManagementURL` which was noted in https://github.com/hashicorp/terraform/pull/4226#r47362510 - with the expectation it could be useful someday (which is probably now).

3.  The errors occur regardless of the value used for `location`, I presume the client is going to https://management.azure.com and failing to find the SubscriptionID.

4. It all works fine with my PublicAzure account

### References
Are there any other GitHub issues (open or closed) or Pull Requests that should be linked here? For example:

https://github.com/hashicorp/terraform/issues/10666

**Comment by glbrtmrgn** [comment]
Hey! I am new to the Terraform codebase and am learning Go, and I'd be open to some pointers from the HashiCorp team and anyone else as I work on this issue.

**Comment by pburkholder** [comment]
Between @stefansherer, @glbrtmrgn and myself we  have folks ready to help on this. Any guidance from @stack72 or @jen20 (Or Mitchell...)? Thanks, P.

**Comment by stack72** [comment]
Hi @pburkholder / @glbrtmrgn 

Looks like a fix has been submitted by @pmcatominey for this in #11026 

This is going to land for Terraform 0.8.3 and will fix your issue

Thanks

Paul
